tweet_id,timestamp,source,text,rating_numerator,rating_denominator,name,dog_stage,jpg_url,img_num,breed_prediction,prediction_accuracy,likes,retweets
763183847194451968,2016-08-10 01:23:03+00:00,iphone,This is Clark. He collects teddy bears. It's absolutely h*ckin horrifying. 8/10 please stop this Clark https://t.co/EDMcwt86fU,18,10,Clark,,https://pbs.twimg.com/media/CpdfpzKWYAAWSUi.jpg,1,miniature_poodle,0.354674,6004,1702
763103485927849985,2016-08-09 20:03:43+00:00,iphone,This is Belle. She's a Butterflop Hufflepoof. Rarer than most. Having trouble with car seat. 10/10 perturbed af https://t.co/VIXT3D26VM,10,10,Belle,,https://pbs.twimg.com/media/CpcWknPXYAAeLP9.jpg,2,chow,0.0390848,8163,2602
762699858130116608,2016-08-08 17:19:51+00:00,iphone,This is Leela. She's a Fetty Woof. Lost eye while saving a baby from an avalanche. 11/10 true h*ckin hero https://t.co/2lBg3ZgivD,11,10,Leela,,https://pbs.twimg.com/media/CpWnecZWIAAUFwt.jpg,1,kelpie,0.519047,13518,4190
762471784394268675,2016-08-08 02:13:34+00:00,iphone,Meet Glenn. Being in public scares him. Frighteningly relatable. 12/10 keep hangin in there Glenn (Imgur - Wuhahha) https://t.co/pA4MDKwRci,12,10,Glenn,,https://pbs.twimg.com/ext_tw_video_thumb/762471745303355393/pu/img/RKcEUz7-VDipoGKJ.jpg,1,Samoyed,0.540276,12571,7612
762464539388485633,2016-08-08 01:44:46+00:00,iphone,This is Buddy. His father was a bear and his mother was a perfectly toasted marshmallow. 12/10 would snug so well https://t.co/zGSj1oUgxx,12,10,Buddy,,https://pbs.twimg.com/media/CpTRc4DUEAAYTq6.jpg,4,chow,0.999953,11503,4839
761976711479193600,2016-08-06 17:26:19+00:00,iphone,This is Shelby. She finds stuff to put on her head for attention. It works really well. 12/10 talented af https://t.co/WTZ484EntP,12,10,Shelby,,https://pbs.twimg.com/media/CpMVxoRXgAAh350.jpg,3,Labrador_retriever,0.475552,5992,2310
761599872357261312,2016-08-05 16:28:54+00:00,iphone,"This is Sephie. According to this picture, she can read. Fantastic at following directions. 11/10 such a good girl https://t.co/7HY9RvCudo",11,10,Sephie,,https://pbs.twimg.com/media/CpG_CrlWYAYyuP3.jpg,1,Gordon_setter,0.240427,4578,1336
761334018830917632,2016-08-04 22:52:29+00:00,iphone,This is Bruce. I really want to hear the joke he was told. 10/10 for chuckle pup https://t.co/ErPLjjJOKc,10,10,Bruce,,https://pbs.twimg.com/media/CpDNQGkWEAENiYZ.jpg,1,Norwegian_elkhound,0.8229360000000001,5792,1669
761292947749015552,2016-08-04 20:09:17+00:00,iphone,Meet Bonaparte. He's pupset because it's cloudy at the beach. Can't take any pics for his Instagram. 11/10 https://t.co/0THNOfv2Jo,11,10,Bonaparte,,https://pbs.twimg.com/media/CpCn5aXXgAAOPTm.jpg,1,standard_poodle,0.6608930000000001,4957,1265
761227390836215808,2016-08-04 15:48:47+00:00,iphone,This is Albert. He just found out that bees are dying globally at an alarming rate. 10/10 heckin worried af now https://t.co/nhLX27WsDY,10,10,Albert,,https://pbs.twimg.com/media/CpBsRleW8AEfO8G.jpg,1,French_bulldog,0.280802,5908,1775
761004547850530816,2016-08-04 01:03:17+00:00,iphone,This is Bo and Ty. Bo eats paper and Ty felt left out. 11/10 for both https://t.co/1acHQS8rvK,11,10,Bo,,https://pbs.twimg.com/media/Co-hmcYXYAASkiG.jpg,1,golden_retriever,0.735163,12482,3952
760656994973933572,2016-08-03 02:02:14+00:00,iphone,This is Rose. Her face is stuck like that. 11/10 would pet so heckin well https://t.co/tl3gNYdoq2,11,10,Rose,,https://pbs.twimg.com/media/Co5lf-KW8AAIwJw.jpg,1,golden_retriever,0.760546,7343,2210
760539183865880579,2016-08-02 18:14:06+00:00,iphone,This is Atlas. Swinging is his passion. 12/10 would push all day https://t.co/9k8LLjJ0uJ,12,10,Atlas,,https://pbs.twimg.com/media/Co36VZfWcAEN3R3.jpg,1,Samoyed,0.988013,8399,4168
760290219849637889,2016-08-02 01:44:48+00:00,twitter.com,This is Rocco. He's doing his best. 13/10 someone help him (IG: rocco_roni) https://t.co/qFsl1nnXMv,13,10,Rocco,,https://pbs.twimg.com/ext_tw_video_thumb/760289324994879489/pu/img/3ItvBEoo4aebPfvr.jpg,1,Old_English_sheepdog,0.3022,29618,13140
759923798737051648,2016-08-01 01:28:46+00:00,iphone,We only rate dogs... this is a Taiwanese Guide Walrus. Im getting real heckin tired of this. Please send dogs. 10/10 https://t.co/49hkNAsubi,10,10,,,https://pbs.twimg.com/media/CovKqSYVIAAUbUW.jpg,1,Labrador_retriever,0.324579,16284,6521
759846353224826880,2016-07-31 20:21:02+00:00,iphone,This is Kirby. He's a Beneblip Cumberpat. Pretty heckin rare. 11/10 would put my face against his face https://t.co/fd6uucghY6,11,10,Kirby,,https://pbs.twimg.com/media/CouEOZhWAAAgFpE.jpg,1,Sussex_spaniel,0.3553949999999999,7433,2265
759557299618865152,2016-07-31 01:12:26+00:00,iphone,This is Emma. She can't believe her last guess didn't hit. Convinced ur stacking them on top of each other. 10/10 https://t.co/JRV1dhBYwu,10,10,Emma,,https://pbs.twimg.com/media/Cop9VVUXgAAhX9u.jpg,2,golden_retriever,0.763333,5202,1341
759447681597108224,2016-07-30 17:56:51+00:00,iphone,This is Oakley. He has no idea what happened here. Even offered to help clean it up. 11/10 such a heckin good boy https://t.co/vT3JM8b989,11,10,Oakley,,https://pbs.twimg.com/media/CooZok_WEAA7oPw.jpg,1,kuvasz,0.223148,9418,2827
759197388317847553,2016-07-30 01:22:17+00:00,iphone,This is Luna. She's just heckin precious af I have nothing else to say. 12/10 https://t.co/gQH2mmKIJW,12,10,Luna,,https://pbs.twimg.com/media/Cok1_sjXgAU3xpp.jpg,1,kuvasz,0.5113409999999999,6725,2221
759099523532779520,2016-07-29 18:53:24+00:00,iphone,Meet Toby. He has a drinking problem. Inflatable marijuana plant in the back is also not a good look. 7/10 cmon Toby https://t.co/Cim4DSj6Oi,17,10,Toby,,https://pbs.twimg.com/media/Cojc_Q0WcAAqi_K.jpg,1,Shetland_sheepdog,0.1290339999999999,16101,4813
759047813560868866,2016-07-29 15:27:55+00:00,iphone,This is Spencer. He's part of the Queen's Guard. Takes his job very seriously. 11/10 https://t.co/8W5iSOgXfx,11,10,Spencer,,https://pbs.twimg.com/media/Coit84_VYAEMtLi.jpg,1,Labrador_retriever,0.778546,7227,2302
758854675097526272,2016-07-29 02:40:28+00:00,iphone,"This is Lilli Bee &amp; Honey Bear. Unfortunately, they were both born with no eyes. So heckin sad. Both 11/10 https://t.co/4UrfOZhztW",11,10,Lilli,,https://pbs.twimg.com/media/Cof-SuqVYAAs4kZ.jpg,4,Old_English_sheepdog,0.0237914,3904,1027
758740312047005698,2016-07-28 19:06:01+00:00,iphone,Meet Boston. He's worried because his tongue won't fit all the way in his mouth. 12/10 it'll be ok deep breaths pup https://t.co/rfWQ4T9iQj,12,10,Boston,,https://pbs.twimg.com/media/CoeWSJcUIAAv3Bq.jpg,1,Chesapeake_Bay_retriever,0.848514,6339,1824
758474966123810816,2016-07-28 01:31:38+00:00,iphone,This is Brandonald. He accidentally opened the front facing camera. Playing it off rather heckin well. 11/10 https://t.co/uPUAotqQtM,11,10,Brandonald,,https://pbs.twimg.com/media/Coak48zWAAAhBxV.jpg,1,Pembroke,0.546145,4227,1132
758467244762497024,2016-07-28 01:00:57+00:00,iphone,Why does this never happen at my front door... 165/150 https://t.co/HmwrdfEfUE,165,10,,,https://pbs.twimg.com/ext_tw_video_thumb/758467147756691456/pu/img/YTNzjRFDSPNXukmM.jpg,1,Labrador_retriever,0.436377,5316,2539
758405701903519748,2016-07-27 20:56:24+00:00,iphone,This is Odie. He falls asleep wherever he wants. Must be nice. 10/10 https://t.co/M9BXCSDVjh,10,10,Odie,,https://pbs.twimg.com/media/CoZl9fXWgAMox0n.jpg,4,Chesapeake_Bay_retriever,0.702954,5756,2204
758355060040593408,2016-07-27 17:35:10+00:00,iphone,This is Corey. He's a Portobello Corgicool. Trying to convince you that he's not a hipster. 11/10 yea right Corey https://t.co/NzWUrFZydr,11,10,Corey,,https://pbs.twimg.com/media/CoY324eWYAEiDOG.jpg,1,Pembroke,0.987643,3797,1245
758041019896193024,2016-07-26 20:47:17+00:00,iphone,Teagan reads entire books in store so they're free. Loved 50 Shades of Grey (how dare I make that joke so late) 9/10 https://t.co/l46jwv5WYv,19,10,,,https://pbs.twimg.com/media/CoUaSKEXYAAYsAl.jpg,1,Cardigan,0.0512653,3001,433
757741869644341248,2016-07-26 00:58:34+00:00,iphone,This is Leonard. He hides in bushes to escape his problems. 10/10 relatable af https://t.co/TdyGTcX0uo,10,10,Leonard,,https://pbs.twimg.com/media/CoQKNY7XYAE_cuX.jpg,1,Old_English_sheepdog,0.128899,7613,3710
757725642876129280,2016-07-25 23:54:05+00:00,iphone,This is Beckham. He fell asleep at the wheel. Very churlish. Looks to have a backpup driver tho. That's good. 11/10 https://t.co/rptsOm73Wr,11,10,Beckham,,https://pbs.twimg.com/media/CoP7c4bWcAAr55g.jpg,2,Labrador_retriever,0.128128,5022,1391
757611664640446465,2016-07-25 16:21:11+00:00,iphone,This is Cooper. He tries to come across as feisty but it never works for very long. 12/10 https://t.co/AVks8DjHwB,12,10,Cooper,,https://pbs.twimg.com/media/CoOTyXJXEAAtjs9.jpg,1,bluetick,0.829259,5026,1272
757400162377592832,2016-07-25 02:20:45+00:00,iphone,She walks herself up and down the train to be petted by all the passengers. 13/10 I can't handle this https://t.co/gwKCspY8N2,13,10,,,https://pbs.twimg.com/media/CoLTbbzXYAElNM6.jpg,1,golden_retriever,0.0878003,16743,7759
757354760399941633,2016-07-24 23:20:20+00:00,iphone,"This is Devón (pronounced ""Eric""). He forgot how to eat the apple halfway through. Wtf Devón get it together. 8/10 https://t.co/7waRPODGyO",18,10,Devón,,https://pbs.twimg.com/media/CoKqIndWgAAattd.jpg,1,Italian_greyhound,0.914667,4995,1637
756998049151549440,2016-07-23 23:42:53+00:00,iphone,This is Oliver. He's an English Creamschnitzel. The rarest of schnitzels. 11/10 would pet quite firmly https://t.co/qbO5X6dYuj,11,10,Oliver,,https://pbs.twimg.com/media/CoFlsGAWgAA2YeV.jpg,4,golden_retriever,0.678555,6923,2271
756651752796094464,2016-07-23 00:46:50+00:00,iphone,This is Gert. He just wants you to be happy. 11/10 would pat on the head so damn well https://t.co/l0Iwj6rLFW,11,10,Gert,,https://pbs.twimg.com/media/CoAqwPTW8AAiJlz.jpg,1,Pembroke,0.294808,5612,1511
756303284449767430,2016-07-22 01:42:09+00:00,iphone,Pwease accept dis rose on behalf of dog. 11/10 https://t.co/az5BVcIV5I,11,10,,,https://pbs.twimg.com/media/Cn7tyyZWYAAPlAY.jpg,1,golden_retriever,0.981652,4359,1231
756288534030475264,2016-07-22 00:43:32+00:00,iphone,Here's a heartwarming scene of a single father raising his two pups. Downright awe-inspiring af. 12/10 for everyone https://t.co/hfddJ0OiNR,12,10,,,https://pbs.twimg.com/media/Cn7gaHrWIAAZJMt.jpg,3,French_bulldog,0.0324922,28519,15071
755110668769038337,2016-07-18 18:43:07+00:00,iphone,This is Watson. He trust falls on command. 13/10 it's elementary... (IG: wat.ki) https://t.co/goX3jewkYN,13,10,Watson,,https://pbs.twimg.com/ext_tw_video_thumb/755110610942169088/pu/img/3-INz45pSRMkzOEF.jpg,1,Labrador_retriever,0.708974,23446,12621
754856583969079297,2016-07-18 01:53:28+00:00,iphone,This is Winnie. She's not a fan of the fast moving air. 11/10 objects in mirror may be more fluffy than they appear https://t.co/FyHrk20gUR,11,10,Winnie,,https://pbs.twimg.com/media/CnnKCKNWgAAcOB8.jpg,2,golden_retriever,0.8723850000000001,7616,2870
754449512966619136,2016-07-16 22:55:55+00:00,iphone,This is Dex. He can see into your past and future. Mesmerizing af 11/10 https://t.co/0dYI0Cpdge,11,10,Dex,,https://pbs.twimg.com/media/CnhXzpvW8AAQ1MB.jpg,1,beagle,0.858513,4147,846
754120377874386944,2016-07-16 01:08:03+00:00,iphone,"When you hear your owner say they need to hatch another egg, but you've already been on 17 walks today. 10/10 https://t.co/lFEoGqZ4oA",10,10,,,https://pbs.twimg.com/media/CncseIzWgAA4ghH.jpg,1,chow,0.168909,8655,2670
754011816964026368,2016-07-15 17:56:40+00:00,iphone,This is Charlie. He pouts until he gets to go on the swing. 12/10 manipulative af https://t.co/ilwQqWFKCh,12,10,Charlie,,https://pbs.twimg.com/media/CnbJuPoXEAAjcVF.jpg,1,French_bulldog,0.600985,9726,4079
753655901052166144,2016-07-14 18:22:23+00:00,iphone,"""The dogtor is in hahahaha no but seriously I'm very qualified and that tumor is definitely malignant"" 10/10 https://t.co/ULqThwWmLg",10,10,,,https://pbs.twimg.com/media/CnWGCpdWgAAWZTI.jpg,1,miniature_pinscher,0.456092,6458,2492
753398408988139520,2016-07-14 01:19:12+00:00,iphone,This is Scout. Her batteries are low. 12/10 precious af https://t.co/ov05LIoQJX,12,10,Scout,,https://pbs.twimg.com/ext_tw_video_thumb/753398183879991296/pu/img/bqFy5Zc_PEk6Mx-B.jpg,1,whippet,0.163794,6384,2186
753375668877008896,2016-07-13 23:48:51+00:00,iphone,This is Hank. He's mischievous af. Doesn't even know what he was trying to do here. 8/10 quit the shit Hank damn https://t.co/3r7wjfsXHc,18,10,Hank,,https://pbs.twimg.com/media/CnSHLFeWgAAwV-I.jpg,1,bluetick,0.360071,8411,2655
753294487569522689,2016-07-13 18:26:16+00:00,iphone,This is Ace. He's a window washer. One of the best around. 11/10 helpful af https://t.co/sTuRoYfzPv,11,10,Ace,,https://pbs.twimg.com/media/CnQ9Vq1WEAEYP01.jpg,1,chow,0.194773,3758,1191
753026973505581056,2016-07-13 00:43:15+00:00,iphone,Say hello to Tayzie. She's a Barbadian Bugaboop. Seems quite social. A rare quality for a Bugaboop. 10/10 petable af https://t.co/6qF5YZx6OV,10,10,Tayzie,,https://pbs.twimg.com/media/CnNKCKKWEAASCMI.jpg,3,Pembroke,0.868511,4283,1109
752917284578922496,2016-07-12 17:27:23+00:00,iphone,This is Grizzie. She's a semi-submerged Bahraini Buttersplotch. Appears alert af. Snazzy tongue. 11/10 would def pet https://t.co/WZ4zzkXXnW,11,10,Grizzie,,https://pbs.twimg.com/media/CnLmRiYXEAAO_8f.jpg,1,German_shepherd,0.609283,7592,1790
752173152931807232,2016-07-10 16:10:29+00:00,iphone,This is Brody. He's a lifeguard. Always prepared for rescue. 12/10 would fake drown just to get saved by him https://t.co/olDmwNjOy1,12,10,Brody,,https://pbs.twimg.com/media/CnBBfNuWcAAkOgO.jpg,1,Labrador_retriever,0.527659,6569,2106
751937170840121344,2016-07-10 00:32:46+00:00,iphone,This is Ruby. Her ice cube is melting. She doesn't know what to do about it. 11/10 https://t.co/Vfc3eAFl2q,11,10,Ruby,,https://pbs.twimg.com/media/Cm9q2d3XEAAqO2m.jpg,1,Lakeland_terrier,0.424168,5770,1530
751830394383790080,2016-07-09 17:28:29+00:00,iphone,This is Tucker. He's very camera shy. 12/10 would give stellar belly rubs to https://t.co/BJRsxuLF1w,12,10,Tucker,,https://pbs.twimg.com/media/Cm8JwBqW8AAFOEn.jpg,1,chow,0.703569,6428,2227
751598357617971201,2016-07-09 02:06:27+00:00,iphone,This is Toby. A cat got his tongue. 13/10 adorable af https://t.co/fHQrBKYSLC,13,10,Toby,,https://pbs.twimg.com/media/Cm42t5vXEAAv4CS.jpg,1,toy_poodle,0.757756,8699,3440
751538714308972544,2016-07-08 22:09:27+00:00,iphone,This is Max. She has one ear that's always slightly more alert than the other. 10/10 wonky af https://t.co/5eJg69G8vY,10,10,Max,,https://pbs.twimg.com/media/Cm4AeG8XEAAulD2.jpg,2,Labrador_retriever,0.516257,5547,1445
751251247299190784,2016-07-08 03:07:09+00:00,iphone,This is Gilbert. He's being chased by a battalion of miniature floof cows. 10/10 we all believe in you Gilbert https://t.co/wayKZkDRTG,10,10,Gilbert,,https://pbs.twimg.com/ext_tw_video_thumb/751250895690731520/pu/img/eziHbU1KbgZg-ijN.jpg,1,Walker_hound,0.178852,13791,6695
751205363882532864,2016-07-08 00:04:50+00:00,iphone,"""This photographer took pics of her best friend before and after she told them they were beautiful"" 12/10 https://t.co/510gJW9fsy",12,10,,,https://pbs.twimg.com/media/CmzRRY1WcAEoxwY.jpg,2,Labrador_retriever,0.947164,6948,2086
750719632563142656,2016-07-06 15:54:42+00:00,iphone,This is Meyer. He has to hold somebody's hand during car rides. He's also wearing a seatbelt. 12/10 responsible af https://t.co/WS6BoApYyL,12,10,Meyer,,https://pbs.twimg.com/media/CmsXg9AWgAAs6Ui.jpg,1,Pembroke,0.972587,14621,5747
750429297815552001,2016-07-05 20:41:01+00:00,iphone,This is Arnie. He's a Nova Scotian Fridge Floof. Rare af. 12/10 https://t.co/lprdOylVpS,12,10,Arnie,,https://pbs.twimg.com/media/CmoPdmHW8AAi8BI.jpg,1,golden_retriever,0.964929,14569,4947
750147208377409536,2016-07-05 02:00:06+00:00,iphone,"And finally, happy 4th of July from the squad 🇺🇸 13/10 for all https://t.co/Mr8Lr3iOUe",13,10,,,https://pbs.twimg.com/media/CmkO57iXgAEOxX9.jpg,1,pug,0.977765,3409,1095
750132105863102464,2016-07-05 01:00:05+00:00,iphone,This is Stewie. He will roundhouse kick anyone who questions his independence. 11/10 free af https://t.co/dDx2gKefYo,11,10,Stewie,,https://pbs.twimg.com/media/CmkBKuwWgAAamOI.jpg,1,toy_poodle,0.478018,3990,1440
750117059602808832,2016-07-05 00:00:18+00:00,iphone,This is Calvin. He just loves America so much. 10/10 would roll around in flag with https://t.co/RXdzWaCQHm,10,10,Calvin,,https://pbs.twimg.com/media/Cmjzc-oWEAESFCm.jpg,2,Shih-Tzu,0.814405,4740,1466
750101899009982464,2016-07-04 23:00:03+00:00,iphone,Meet Lilah. She agreed on one quick pic. Now she'd like to go mentally prepare for the onslaught of fireworks. 11/10 https://t.co/enCpXzZHkD,11,10,Lilah,,https://pbs.twimg.com/media/Cmjlsh1XgAEvhq_.jpg,2,golden_retriever,0.316704,3344,959
750086836815486976,2016-07-04 22:00:12+00:00,tweetdeck,This is Spanky. He was a member of the 2002 USA Winter Olympic speed skating team. Accomplished af. 12/10 https://t.co/7tlZPrePXd,12,10,Spanky,,https://pbs.twimg.com/media/Cmf5WLGWYAAcmRw.jpg,1,pug,0.978277,2383,613
750056684286914561,2016-07-04 20:00:23+00:00,tweetdeck,This is Jameson. He had a few too many in the name of freedom. I can't not respect that. 11/10 'Merica https://t.co/8zQvXM6pG5,11,10,Jameson,,https://pbs.twimg.com/media/Cmfx2oNW8AAGg4H.jpg,1,Saluki,0.4844279999999999,3444,1011
750041628174217216,2016-07-04 19:00:33+00:00,tweetdeck,This is Beau. He's trying to keep his daddy from packing to leave for Annual Training. 13/10 and now I'm crying https://t.co/7JeDfQvzzI,13,10,Beau,,https://pbs.twimg.com/media/CmfssOtXYAAKa_Z.jpg,1,Labrador_retriever,0.252031,3502,703
750026558547456000,2016-07-04 18:00:41+00:00,tweetdeck,Meet Jax &amp; Jil. Jil is yelling the pledge of allegiance. If u cant take the freedom get out the kitchen Jax. 10/10s https://t.co/jrg29NDNhI,10,10,Jax,,https://pbs.twimg.com/media/CmieRQRXgAA8MV3.jpg,1,standard_poodle,0.258732,2986,888
749996283729883136,2016-07-04 16:00:22+00:00,tweetdeck,This is Bo. He emanates happiness. 12/10 I could cut the freedom with a knife https://t.co/c7LNFt39eR,12,10,Bo,,https://pbs.twimg.com/media/CmfoyrrW8AA8v7w.jpg,1,Old_English_sheepdog,0.515319,3331,919
749774190421639168,2016-07-04 01:17:51+00:00,iphone,This is Lucy. She's a Benebop Cumberplop. 12/10 would hold against my face https://t.co/4yXa801fgl,12,10,Lucy,,https://pbs.twimg.com/media/Cme7pg2XEAATMnP.jpg,1,Pekinese,0.8790120000000001,5114,1493
749403093750648834,2016-07-03 00:43:15+00:00,iphone,Duuun dun... duuun dun... dunn  dun. dunn dun. dun dun dun dun dun dun dun dun dun dun dun dun dun dun dun. 10/10 https://t.co/9qdJ2Q1Cwx,10,10,,,https://pbs.twimg.com/media/CmZqIslWIAQFiqe.jpg,1,Chesapeake_Bay_retriever,0.694541,2892,622
749395845976588288,2016-07-03 00:14:27+00:00,iphone,This is George. He just remembered that bees are dying globally at an alarming rate. Scary stuff George. 10/10 https://t.co/lznl6QGkYc,10,10,George,,https://pbs.twimg.com/media/CmZjizYW8AA3FCN.jpg,1,Pomeranian,0.973715,9488,3951
749064354620928000,2016-07-02 02:17:13+00:00,iphone,Meet Winston. He's pupset because I forgot to mention that it's Canada Day today. 11/10 please forgive me Winston https://t.co/xEY8dbJxnF,11,10,Winston,,https://pbs.twimg.com/media/CmU2DVWWgAArvp3.jpg,2,pug,0.985222,5277,1714
749036806121881602,2016-07-02 00:27:45+00:00,iphone,This is Dietrich. He hops at random. Other doggos don't understand him. It upsets him greatly. 8/10 would comfort https://t.co/U8cSRz8wzC,18,10,Dietrich,,https://pbs.twimg.com/media/CmUciKgWIAA97sH.jpg,1,West_Highland_white_terrier,0.0195223,3425,896
748977405889503236,2016-07-01 20:31:43+00:00,iphone,What jokester sent in a pic without a dog in it? This is not @rock_rates. This is @dog_rates. Thank you ...10/10 https://t.co/nDPaYHrtNX,10,10,,,https://pbs.twimg.com/media/CmTm-XQXEAAEyN6.jpg,1,German_short-haired_pointer,0.742216,11235,3759
748699167502000129,2016-07-01 02:06:06+00:00,iphone,Meet Tripp. He's being eaten by a sherk and doesn't even care. Unfazed af. 11/10 keep doin you Tripp https://t.co/gGxjthmG1c,11,10,Tripp,,https://pbs.twimg.com/media/CmPp5pOXgAAD_SG.jpg,1,Pembroke,0.849029,5213,1814
748575535303884801,2016-06-30 17:54:50+00:00,iphone,This is one of the most reckless puppers I've ever seen. How she got a license in the first place is beyond me. 6/10 https://t.co/z5bAdtn9kd,16,10,,,https://pbs.twimg.com/media/CmN5ecNWMAE6pnf.jpg,1,soft-coated_wheaten_terrier,0.0864988,6696,2272
748568946752774144,2016-06-30 17:28:39+00:00,iphone,This is Cora. She rings a bell for treats. 12/10 precious af (vid by @skyehellenkamp) https://t.co/uUncaAGH18,12,10,Cora,,https://pbs.twimg.com/ext_tw_video_thumb/748568890477789184/pu/img/1MzP7FuodJdHw8zA.jpg,1,Tibetan_terrier,0.328161,2411,776
748346686624440324,2016-06-30 02:45:28+00:00,iphone,"""So... we meat again"" (I'm so sorry for that pun I couldn't resist pls don't unfollow) 10/10 https://t.co/XFBrrqapZa",10,10,,,https://pbs.twimg.com/media/CmKpVtlWAAEnyHm.jpg,1,borzoi,0.5964550000000001,5735,1413
748324050481647620,2016-06-30 01:15:31+00:00,iphone,This is Duke. He permanently looks like he just tripped over something. 11/10 https://t.co/1sNtG7GgiO,11,10,Duke,,https://pbs.twimg.com/media/CmKUwImXIAA58f5.jpg,1,Shetland_sheepdog,0.880499,4078,867
747933425676525569,2016-06-28 23:23:19+00:00,iphone,Pls don't send more sherks. I don't care how seemingly floofy they are. It does me so much frighten. Thank u. 11/10 https://t.co/oQqlOsla4R,11,10,,,https://pbs.twimg.com/media/CmExV2qWkAAn_pN.jpg,1,Samoyed,0.998201,7310,2894
747885874273214464,2016-06-28 20:14:22+00:00,iphone,This is a mighty rare blue-tailed hammer sherk. Human almost lost a limb trying to take these. Be careful guys. 8/10 https://t.co/TGenMeXreW,18,10,,,https://pbs.twimg.com/media/CmEGMSvUYAAl3ZM.jpg,1,kuvasz,0.40845,3243,1116
747844099428986880,2016-06-28 17:28:22+00:00,iphone,This is Huxley. He's pumped for #BarkWeek. Even has a hat. Ears are quite magical. 11/10 would remove hat to pat https://t.co/V7h5NMYbYz,11,10,Huxley,,https://pbs.twimg.com/media/CmDgPTsWEAIi2T1.jpg,1,Pembroke,0.360428,3084,851
747816857231626240,2016-06-28 15:40:07+00:00,iphone,Viewer discretion is advised. This is a terrible attack in progress. Not even in water (tragic af). 4/10 bad sherk https://t.co/L3U0j14N5R,14,10,,,https://pbs.twimg.com/media/CmDHdCoWkAACTB4.jpg,1,Pembroke,0.7689229999999999,5346,1316
747600769478692864,2016-06-28 01:21:27+00:00,iphone,This is Bookstore and Seaweed. Bookstore is tired and Seaweed is an asshole. 10/10 and 7/10 respectively https://t.co/eUGjGjjFVJ,10,10,Bookstore,,https://pbs.twimg.com/media/CmAC7ehXEAAqSuW.jpg,1,Chesapeake_Bay_retriever,0.804363,2545,619
747594051852075008,2016-06-28 00:54:46+00:00,iphone,Again w the sharks guys. This week is about dogs ACTING or DRESSING like sharks. NOT actual sharks. Thank u ...11/10 https://t.co/Ie2mWXWjpr,11,10,,,https://pbs.twimg.com/media/Cl_80k5WkAEbo9m.jpg,1,basenji,0.389136,4065,1205
747512671126323200,2016-06-27 19:31:23+00:00,iphone,Guys pls stop sending actual sharks. It's too dangerous for me and the people taking the photos. Thank you ...10/10 https://t.co/12lICZN2SP,10,10,,,https://pbs.twimg.com/media/Cl-yykwWkAAqUCE.jpg,1,Cardigan,0.111493,6110,1803
747219827526344708,2016-06-27 00:07:44+00:00,iphone,This is Atticus. He's remaining calm but his costume looks terrified. 11/10 https://t.co/uT7QeZI34U,11,10,Atticus,,https://pbs.twimg.com/media/Cl6odlVWQAIy5uk.jpg,2,Shetland_sheepdog,0.548018,5792,1791
747103485104099331,2016-06-26 16:25:26+00:00,iphone,"Guys... I said DOGS with ""shark qualities"" or ""costumes."" Not actual sharks. This did me a real frighten ...11/10 https://t.co/DX1JUHJVN7",11,10,,,https://pbs.twimg.com/media/Cl4-pevXEAAb8VW.jpg,1,Labrador_retriever,0.991954,10534,4548
746872823977771008,2016-06-26 01:08:52+00:00,iphone,This is a carrot. We only rate dogs. Please only send in dogs. You all really should know this by now ...11/10 https://t.co/9e48aPrBm2,11,10,,,https://pbs.twimg.com/media/Cl1s1p7WMAA44Vk.jpg,1,Pembroke,0.540201,6593,2429
746790600704425984,2016-06-25 19:42:08+00:00,iphone,When you just can't resist... 10/10 topnotch tongue https://t.co/jeWEGUgbXf,10,10,,,https://pbs.twimg.com/media/Cl0iFdeXEAQtPyT.jpg,3,Boston_bull,0.936183,5345,1806
746726898085036033,2016-06-25 15:29:00+00:00,iphone,Meet Abby. She's incredibly distracting. Just wants to help steer. Hazardous af. Still 12/10 would pet while driving https://t.co/gLbLiZtwsp,12,10,Abby,,https://pbs.twimg.com/media/ClzoJz7WYAELHSf.jpg,1,golden_retriever,0.256505,6648,2037
746507379341139972,2016-06-25 00:56:43+00:00,iphone,This is Shiloh. She did not pass the soft mouth egg test. 10/10 would absolutely still pet https://t.co/PlR6hjqvr5,10,10,Shiloh,,https://pbs.twimg.com/media/Clwgf4bWgAAB15c.jpg,1,toy_poodle,0.508292,5094,1226
746369468511756288,2016-06-24 15:48:42+00:00,iphone,This is an Iraqi Speed Kangaroo. It is not a dog. Please only send in dogs. I'm very angry with all of you ...9/10 https://t.co/5qpBTTpgUt,19,10,,,https://pbs.twimg.com/media/ClujESVXEAA4uH8.jpg,1,German_shepherd,0.622957,6637,1854
746131877086527488,2016-06-24 00:04:36+00:00,iphone,This is Gustav. He has claimed that plant. It is his now. 10/10 would not try to take his plant away https://t.co/uRI7HBgGJX,10,10,Gustav,,https://pbs.twimg.com/media/ClrK-rGWAAENcAa.jpg,1,chow,0.575637,7565,2511
746056683365994496,2016-06-23 19:05:49+00:00,iphone,This is Arlen and Thumpelina. They are best pals. Cuddly af. 11/10 for both puppers https://t.co/VJgbgIzIHx,11,10,Arlen,,https://pbs.twimg.com/media/ClqGl7fXIAA8nDe.jpg,1,Shetland_sheepdog,0.43332,3904,931
745789745784041472,2016-06-23 01:25:06+00:00,iphone,This is Gus. He didn't win the Powerball. Quite perturbed about it. Still 10/10 would comfort in time of need https://t.co/3wc246LOtu,10,10,Gus,,https://pbs.twimg.com/media/ClmT0KHWkAAXbhy.jpg,1,Pekinese,0.984267,4437,1207
