tweet_id,timestamp,source,text,rating_numerator,rating_denominator,name,dog_stage,jpg_url,img_num,breed_prediction,prediction_accuracy,likes,retweets
857746408056729600,2017-04-28 00:00:54+00:00,iphone,Meet Thor. He doesn't have finals because he's a dog but is pupset you have finals. Just wants to play. 13/10 would abandon education for https://t.co/7IFn3rkJai,13,10,Thor,,https://pbs.twimg.com/media/C-dTzBzXUAQRjYz.jpg,1,Labrador_retriever,0.919832,36021,11524
857393404942143489,2017-04-27 00:38:11+00:00,iphone,"Instead of the usual nightly dog rate, I'm sharing this story with you. Meeko is 13/10 and would like your help 

https://t.co/Mj4j6QoIJk https://t.co/JdNE5oqYEV",13,10,,,https://pbs.twimg.com/media/C-YSwA_XgAEOr25.jpg,3,malamute,0.8415969999999999,6236,1785
857263160327368704,2017-04-26 16:00:39+00:00,iphone,This is Oscar and Oliver. Oliver shrunk Oscar. Oscar isn't pleased about it. Quite pupset tbh. Oliver doesn't seem to mind. Both 13/10 https://t.co/e3U4NReleC,13,10,Oscar,,https://pbs.twimg.com/media/C-WcS4MXoAADrBU.jpg,1,Samoyed,0.998021,21041,4934
857029823797047296,2017-04-26 00:33:27+00:00,iphone,This is Zeke. He performs group cheeky wink tutorials. Pawfect execution here. 12/10 would wink back https://t.co/uMH5CLjXJu,12,10,Zeke,,https://pbs.twimg.com/media/C-TIEwMW0AEjb55.jpg,2,golden_retriever,0.968623,19910,4364
856543823941562368,2017-04-24 16:22:16+00:00,iphone,This is Callie. She'll be your navigator today. Takes her job very seriously. Will shift for you. One ear always in the pupholder. 12/10 https://t.co/Bh9DtLhIBO,12,10,Callie,,https://pbs.twimg.com/media/C-MOEDCXYAEjp7o.jpg,1,Boston_bull,0.30691,17135,3131
856282028240666624,2017-04-23 23:01:59+00:00,iphone,"This is Cermet, Paesh, and Morple. They are absolute h*ckin superstars. Watered every day so they can grow. 14/10 for all https://t.co/GUefqUmZv8",14,10,Cermet,,https://pbs.twimg.com/media/C-If9ZwXoAAfDX2.jpg,4,Chihuahua,0.8765430000000001,29086,6841
855459453768019968,2017-04-21 16:33:22+00:00,iphone,"Guys, we only rate dogs. This is quite clearly a bulbasaur. Please only send dogs. Thank you... 12/10 human used pet, it's super effective https://t.co/Xc7uj1C64x",12,10,,,https://pbs.twimg.com/media/C98z1ZAXsAEIFFn.jpg,2,Blenheim_spaniel,0.389513,31657,8987
854732716440526848,2017-04-19 16:25:34+00:00,iphone,This is Marlee. She fetched a flower and immediately requested that it be placed behind her ear. 12/10 elegant af https://t.co/nJztIEON5s,12,10,Marlee,,https://pbs.twimg.com/media/C9ye3b3WAAAlTo0.jpg,1,Pembroke,0.6955479999999999,24188,6690
854482394044301312,2017-04-18 23:50:52+00:00,iphone,This is Arya. She can barely contain her excitement for more peanut butter. Also patriotic af. 13/10 https://t.co/AL4Ahm1Rm5,13,10,Arya,,https://pbs.twimg.com/media/C9u7MtmV0AA741s.jpg,1,Chihuahua,0.260242,31131,7608
854365224396361728,2017-04-18 16:05:17+00:00,iphone,This is Einstein. He's having a really good day. Hopes you are too. H*ckin nifty tongue. 13/10 would snug intensely https://t.co/mdaQhhfpv6,13,10,Einstein,,https://pbs.twimg.com/media/C9tQokgUIAEETSx.jpg,1,Pembroke,0.90708,20046,5159
853760880890318849,2017-04-17 00:03:50+00:00,iphone,Say hello to Alice. I'm told she enjoys car rides and smells good. 12/10 would give her everything she could ever want https://t.co/yT4vw8y77x,12,10,Alice,,https://pbs.twimg.com/media/C9kq_bbVwAAuRZd.jpg,1,miniature_pinscher,0.292519,30414,6403
853639147608842240,2017-04-16 16:00:07+00:00,iphone,A photographer took pictures before and after he told his bunny he's a good boy. Here are the results. 13/10 https://t.co/wiQZIsaWUe,13,10,,,https://pbs.twimg.com/media/C9i8RhhXoAAdkMT.jpg,1,German_shepherd,0.509879,37198,11265
852912242202992640,2017-04-14 15:51:39+00:00,iphone,"Meet Benny. He likes being adorable and making fun of you while you're on the trampoline. 12/10 let's help him out

https://t.co/aVMjBqAy1x https://t.co/7gx2LksT3U",12,10,Benny,,https://pbs.twimg.com/media/C9YnKK3VoAAxn1E.jpg,1,Great_Dane,0.7837649999999999,9658,2037
852672615818899456,2017-04-13 23:59:28+00:00,iphone,This is Aspen. She's never tasted a stick so succulent. On the verge of tears. A face of pure appreciation. 12/10 https://t.co/VlyBzOXHEW,12,10,Aspen,,https://pbs.twimg.com/media/C9VNNp1XkAEWRFb.jpg,1,golden_retriever,0.7112350000000001,15939,2388
852553447878664193,2017-04-13 16:05:56+00:00,iphone,This is Jarod. He likes having his belly brushed. Tongue ejects when you hit the right spot. 13/10 downright h*ckin adorable https://t.co/ArnxkyD2kC,13,10,Jarod,,https://pbs.twimg.com/media/C9Tg1bPW0AkAMDI.jpg,1,bloodhound,0.186498,17492,3885
852189679701164033,2017-04-12 16:00:27+00:00,iphone,This is Sailor. He has collected the best dirt in the area. As any good boy would. Under the impression you know what to do next. 12/10 https://t.co/jrFzScKWEG,12,10,Sailor,,https://pbs.twimg.com/media/C9OV99SXsAEmj1U.jpg,1,Bernese_mountain_dog,0.4153739999999999,12217,1741
851591660324737024,2017-04-11 00:24:08+00:00,iphone,Oh jeez u did me quite the spook little fella. We normally don't rate triceratops but this one seems suspiciously good. 11/10 would pet well https://t.co/BMtfCmNbnS,11,10,,,https://pbs.twimg.com/media/C9F2FG5WAAAJ0iN.jpg,1,Cardigan,0.394507,17300,3819
851224888060895234,2017-04-10 00:06:42+00:00,iphone,"Meet Snoop. His number one passion is sticking his head out of car windows, so he purchased some doggles. Stylish af. 13/10 happy travels https://t.co/iHYfZdz444",13,10,Snoop,,https://pbs.twimg.com/media/C9AohFoWsAUmxDs.jpg,3,standard_poodle,0.00568265,22090,6350
850753642995093505,2017-04-08 16:54:09+00:00,iphone,"This is Kyle. He made a joke about your shoes, then stuck his tongue out at you. Uncalled for. Step the h*ck up Kyle. 11/10 would forgive https://t.co/hLQ2Ilg2uN",11,10,Kyle,,https://pbs.twimg.com/media/C8576jrW0AEYWFy.jpg,1,pug,0.996952,33348,10352
850380195714523136,2017-04-07 16:10:12+00:00,iphone,This is Leo. He's a personal triathlon coach. Currently overseeing this athlete's push-pups. H*ckin brutal. 13/10 would do all he asks of me https://t.co/FXZQtBcnTO,13,10,Leo,,https://pbs.twimg.com/ext_tw_video_thumb/850380153985355777/pu/img/lFouhg-EZvJs8eMr.jpg,1,Yorkshire_terrier,0.2490119999999999,13994,2915
850145622816686080,2017-04-07 00:38:06+00:00,iphone,This is Riley. He's making new friends. Jubilant as h*ck for the fun times ahead. 11/10 for all pups pictured https://t.co/PCX25VV78l,11,10,Riley,,https://pbs.twimg.com/media/C8xS655XkAAv9vo.jpg,2,kelpie,0.10539,17519,4244
849776966551130114,2017-04-06 00:13:11+00:00,iphone,Seriously guys? Again? We only rate dogs. Please stop submitting other things like this super good hammerhead shark. Thank you... 12/10 https://t.co/TCMC90mSOT,12,10,,,https://pbs.twimg.com/media/C8sDpDWWsAE5P08.jpg,2,Chihuahua,0.292092,32390,8404
849412302885593088,2017-04-05 00:04:08+00:00,iphone,This is Noosh. He noticed you were in the shower and thought you could use some company. 12/10 h*ckin loyal https://t.co/Uq3ChFgWA3,12,10,Noosh,,https://pbs.twimg.com/media/C8m3-iQVoAAETnF.jpg,4,schipperke,0.907559,17039,3487
848690551926992896,2017-04-03 00:16:10+00:00,iphone,Please stop sending in animals other than dogs. We only rate dogs. Not Furry Ecuadorian Sea Turtles. Thank you... 12/10 https://t.co/UOE79zb6VU,12,10,,,https://pbs.twimg.com/media/C8cnjHuXsAAoZQf.jpg,1,flat-coated_retriever,0.8236479999999999,27104,4826
848324959059550208,2017-04-02 00:03:26+00:00,iphone,Meet Odin. He's supposed to be giving directions but he'd rather look at u like that. Should probably buckle pup. 12/10 distracting as h*ck https://t.co/1pSqUbLQ5Z,12,10,Odin,,https://pbs.twimg.com/media/C8XbDR1WAAAxND8.jpg,1,malamute,0.5445760000000001,20229,4037
848212111729840128,2017-04-01 16:35:01+00:00,iphone,"This is Jerry. He's doing a distinguished tongue slip. Slightly patronizing tbh. You think you're better than us, Jerry? 6/10 hold me back https://t.co/DkOBbwulw1",16,10,Jerry,,https://pbs.twimg.com/media/C8V0aI5V0AAgO9m.jpg,1,Bedlington_terrier,0.333486,17618,3444
847842811428974592,2017-03-31 16:07:33+00:00,iphone,"This is Rontu. He is described as a pal, cuddle bug, protector and constant shadow. 12/10, but he needs your help

https://t.co/zK4cpKPFfU https://t.co/7Xvoalr798",12,10,Rontu,,https://pbs.twimg.com/media/C8QkidrVYAQXQh7.jpg,1,Bernese_mountain_dog,0.951337,5935,1522
847606175596138505,2017-03-31 00:27:14+00:00,iphone,This is Cannon. He just heard something behind him. Fr*ckin frightened af. 12/10 don't look back just run https://t.co/WTPBWT6Ux1,12,10,Cannon,,https://pbs.twimg.com/media/C8NNUDBUMAE0XxJ.jpg,1,Cardigan,0.413688,20208,3774
847251039262605312,2017-03-30 00:56:03+00:00,iphone,This is Furzey. He's doing an elevated sandy zoom. Adjusts ears to steer. 12/10 would pet mid flight https://t.co/zhbRIZQgnq,12,10,Furzey,,https://pbs.twimg.com/media/C8IKUjAUwAEP-En.jpg,1,Airedale,0.49538,22036,4800
847157206088847362,2017-03-29 18:43:12+00:00,iphone,"Meet Daisy. She's been pup for adoption for months now but hasn't gotten any applications. 11/10 let's change that

https://t.co/Jlb9L0m3J0 https://t.co/Eh7fGFuy6r",11,10,Daisy,,https://pbs.twimg.com/media/C8G0_CMWsAAjjAY.jpg,2,Staffordshire_bullterrier,0.219609,21588,6572
847116187444137987,2017-03-29 16:00:12+00:00,iphone,Unbelievable... We. Only. Rate. Dogs. Please stop sending in other things like this Blossoming Flop Kangaroo. Thank you... 11/10 https://t.co/EeeErAbso0,11,10,,,https://pbs.twimg.com/media/C8GPrNDW4AAkLde.jpg,1,American_Staffordshire_terrier,0.113434,23108,3583
846874817362120707,2017-03-29 00:01:05+00:00,iphone,"This is Tuck. As you can see, he's rather h*ckin rare. Taken seriously until his legs are seen. Tail stuck in a permanent zoom. 13/10 https://t.co/P7PBGqrKSe",13,10,Tuck,,https://pbs.twimg.com/media/C8C0JYHW0AAy-7u.jpg,2,Shetland_sheepdog,0.450539,21685,4404
846153765933735936,2017-03-27 00:15:53+00:00,iphone,This is Vixen. He really likes bananas. Steals them when he thinks nobody's watching. 13/10 opportunistic af https://t.co/a0CkS5ExFR,13,10,Vixen,,https://pbs.twimg.com/media/C74kWqoU8AEaf3v.jpg,1,giant_schnauzer,0.346468,34394,10226
846042936437604353,2017-03-26 16:55:29+00:00,iphone,Meet Jarvis. The snow pupsets him. Officially ready for summer. 12/10 would perform a chilly boop https://t.co/0hLkztpiOW,12,10,Jarvis,,https://pbs.twimg.com/media/C72_iaUVUAEhZSn.jpg,1,golden_retriever,0.96111,17256,3224
845812042753855489,2017-03-26 01:38:00+00:00,iphone,We usually don't rate polar bears but this one seems extra good. Majestic as h*ck. 13/10 would hug for a while https://t.co/TLNexlqzXP,13,10,,,https://pbs.twimg.com/media/C7ztkInW0AEh1CD.jpg,1,Samoyed,0.979803,31737,9894
845677943972139009,2017-03-25 16:45:08+00:00,iphone,"C'mon guys. Please only send in dogs. We only rate dogs, not Exceptional-Tongued Peruvian Floor Bears. Thank you... 12/10 https://t.co/z30iQLiXNo",12,10,,,https://pbs.twimg.com/media/C7xzmngWkAAAp9C.jpg,1,chow,0.8086810000000001,27154,5365
844973813909606400,2017-03-23 18:07:10+00:00,iphone,"This is Brady. He's a recovering alcoholic. Demonstrating incredible restraint here. 12/10 don't give pup, don't give in, Brady https://t.co/B1iBuSq3hr",12,10,Brady,,https://pbs.twimg.com/media/C7nzMwTV4AARz4t.jpg,1,Labrador_retriever,0.742421,16361,3617
844704788403113984,2017-03-23 00:18:10+00:00,iphone,This is Luna. It's her first time outside and a bee stung her nose. Completely h*ckin uncalled for. 13/10 where's the bee I just wanna talk https://t.co/2RYiLGHuPN,13,10,Luna,,https://pbs.twimg.com/media/C7j-hkSW0AIxCZC.jpg,1,Labrador_retriever,0.980213,42022,11633
844223788422217728,2017-03-21 16:26:50+00:00,iphone,This is Margo. She just dug pup a massive hole. Can't wait for you to see it. H*ckin proud of herself. 12/10 would forgive then pet https://t.co/H38HB6rBTx,12,10,Margo,,https://pbs.twimg.com/media/C7dJCnqU4AAswat.jpg,1,Labrador_retriever,0.71951,14753,2450
843856843873095681,2017-03-20 16:08:44+00:00,iphone,Say hello to Sadie and Daisy. They do all their shopping together. Can never agree on what to get. Like an old married pupple. Both 12/10 https://t.co/f5C5l5wa0e,12,10,Sadie,,https://pbs.twimg.com/media/C7X7Ui0XgAA3m19.jpg,1,Labrador_retriever,0.92254,23211,5220
843604394117681152,2017-03-19 23:25:35+00:00,iphone,This is Hank. He's been outside for 3 minutes and already made a friend. Way to go Hank. 11/10 for both https://t.co/wHUElL84RC,11,10,Hank,,https://pbs.twimg.com/media/C7UVuE_U0AI8GGl.jpg,1,Labrador_retriever,0.430583,18310,3081
843235543001513987,2017-03-18 22:59:54+00:00,iphone,This is Tycho. She just had new wheels installed. About to do a zoom. 0-60 in 2.4 seconds. 13/10 inspirational as h*ck https://t.co/DKwp2ByMsL,13,10,Tycho,,https://pbs.twimg.com/media/C7PGQJAWwAAibui.jpg,1,Pembroke,0.958452,23315,6852
842846295480000512,2017-03-17 21:13:10+00:00,iphone,This is Charlie. He's wishing you a very fun and safe St. Pawtrick's Day. 13/10 festive af https://t.co/nFpNgCWWYs,13,10,Charlie,,https://pbs.twimg.com/media/C7JkO0rX0AErh7X.jpg,1,Labrador_retriever,0.461076,16440,4023
842765311967449089,2017-03-17 15:51:22+00:00,iphone,"Meet Indie. She's not a fan of baths but she's definitely a fan of hide &amp; seek. 12/10 click the link to help Indie

https://t.co/fvGkIuAlFK https://t.co/kiCFtmJd7l",12,10,Indie,,https://pbs.twimg.com/media/C7IalMVX0AATKRD.jpg,1,Labrador_retriever,0.0293399,7321,1439
842535590457499648,2017-03-17 00:38:32+00:00,iphone,This is Winnie. She lost her body saving a children's hospital from an avalanche. 13/10 what a h*ckin hero https://t.co/Tf0rh9ZgZe,13,10,Winnie,,https://pbs.twimg.com/media/C7FJpgVW4AIDzi6.jpg,1,Pembroke,0.685084,19637,3937
842163532590374912,2017-03-16 00:00:07+00:00,iphone,Meet George. He looks slightly deflated but overall quite powerful. Not sure how that human restrained him. 12/10 would snug with permission https://t.co/o6E0hB3xZl,12,10,George,,https://pbs.twimg.com/media/C6_3QgMWsAMNnAk.jpg,2,French_bulldog,0.891227,26569,6568
842115215311396866,2017-03-15 20:48:07+00:00,iphone,This is Bentley. It's his first time going to the beach. I think he's a fan. 12/10 would build sand castles with https://t.co/iDK4OyQJoy,12,10,Bentley,,https://pbs.twimg.com/media/C6_LTCZWoAAKm_O.jpg,1,chow,0.293493,15204,3386
841680585030541313,2017-03-14 16:01:03+00:00,iphone,"This is Penny. She's a dragon slayer. Feared by most, if not all, dragons. Showing off her latest victim here. 12/10 would pet with caution https://t.co/qUOijSlPnj",12,10,Penny,,https://pbs.twimg.com/media/C65AA7_WoAEGqA9.jpg,1,Chihuahua,0.547401,27854,8748
841439858740625411,2017-03-14 00:04:30+00:00,iphone,Here we have some incredible doggos for #K9VeteransDay. All brave as h*ck. Salute your dog in solidarity. 14/10 for all https://t.co/SVNMdFqKDL,14,10,,,https://pbs.twimg.com/media/C61lFFiWoAAJdiL.jpg,3,Labrador_retriever,0.0481999,13755,4168
841314665196081154,2017-03-13 15:47:01+00:00,twitter.com,This is Max. There's no way in h*ck you're taking his pacifier. Binky promises it's not happening. 13/10 very good stubborn boy https://t.co/9lVAqDEvZ5,13,10,Max,,https://pbs.twimg.com/ext_tw_video_thumb/841311812641533952/pu/img/sBUGt8u76n9azPWI.jpg,1,Afghan_hound,0.903712,17305,5312
841077006473256960,2017-03-13 00:02:39+00:00,iphone,This is Dawn. She's just checking pup on you. Making sure you're doing okay. 12/10 she's here if you need her https://t.co/XKJrmO4fAQ,12,10,Dawn,,https://pbs.twimg.com/media/C6wbE5bXUAAh1Hv.jpg,1,Brittany_spaniel,0.962985,24926,5991
840632337062862849,2017-03-11 18:35:42+00:00,iphone,"Say hello to Maddie and Gunner. They are considerably pupset about bath time. Both 12/10 but Gunner needs your help

https://t.co/JesYTzb1Jo https://t.co/5cncH08G1o",12,10,Maddie,,https://pbs.twimg.com/media/C6qGphPV4AEKrdc.jpg,1,golden_retriever,0.711148,9761,1972
840268004936019968,2017-03-10 18:27:58+00:00,iphone,This is Monty. He makes instantly regrettable decisions. Couldn't help himself. It looked like a ghost lollipop. 12/10 mistake happen https://t.co/8Wsr6b4RjE,12,10,Monty,,https://pbs.twimg.com/media/C6k7SaEXUAg83_J.jpg,3,Chesapeake_Bay_retriever,0.8639870000000001,20950,6497
839990271299457024,2017-03-10 00:04:21+00:00,iphone,Meet Sojourner. His nose is a Fibonacci Spiral. Legendary af. 13/10 we must protect him at all costs https://t.co/r7W1NbkOtr,13,10,Sojourner,,https://pbs.twimg.com/media/C6g-sX-VsAAHfJ9.jpg,2,Staffordshire_bullterrier,0.604938,14640,2597
839549326359670784,2017-03-08 18:52:12+00:00,iphone,"Meet Winston. He knows he's a little too big for the swing, but he doesn't care. Kindly requests a push. 12/10 would happily oblige https://t.co/GuxEXTdnMu",12,10,Winston,,https://pbs.twimg.com/media/C6atpTLWYAIL7bU.jpg,1,Norwich_terrier,0.05248,29957,8805
839239871831150596,2017-03-07 22:22:32+00:00,iphone,This is Odie. He's big. 13/10 would attempt to ride https://t.co/JEXB9RwBmm,13,10,Odie,,https://pbs.twimg.com/media/C6WUNadWYAAPxHv.jpg,3,Leonberg,0.927021,29684,7422
838921590096166913,2017-03-07 01:17:48+00:00,iphone,This is Arlo. He's officially the king of snowy tongue slips. 13/10 would comfort during inevitable brain freeze https://t.co/oXVu9pNZZv,13,10,Arlo,,https://pbs.twimg.com/media/C6Ryuf7UoAAFX4a.jpg,1,Border_terrier,0.664538,12183,2357
838561493054533637,2017-03-06 01:26:54+00:00,iphone,This is Walter. His owner has been watching all the Iditarod coverage and is convinced Walter can be a sled dog. 13/10 Walter isn't so sure https://t.co/0av1PEehFI,13,10,Walter,,https://pbs.twimg.com/media/C6MrOsEXQAENOds.jpg,1,kelpie,0.2165619999999999,11892,1504
838476387338051585,2017-03-05 19:48:43+00:00,iphone,This is Stanley. Somehow he heard you tell him he's a good boy from all the way up there. 13/10 I love you Stanley https://t.co/51FXNuouHI,13,10,Stanley,,https://pbs.twimg.com/media/C6Ld0wYWgAQQqMC.jpg,3,Great_Pyrenees,0.997692,24664,5484
838083903487373313,2017-03-04 17:49:08+00:00,iphone,This is Daisy. She's puppears to be rare as all h*ck. Only seven like her currently domesticated. 13/10 pettable af https://t.co/meUc8jufAO,13,10,Daisy,,https://pbs.twimg.com/media/C6F42cGUYAAIKsX.jpg,2,chow,0.800975,19183,3582
837471256429613056,2017-03-03 01:14:41+00:00,iphone,This is Vincent. He's suave as h*ck. Will be your copilot this evening. Claims he doesn't need to look at the directions. 12/10 https://t.co/u51tzXSVi3,12,10,Vincent,,https://pbs.twimg.com/media/C59LpELWUAEUmYh.jpg,1,Norwegian_elkhound,0.976255,13967,2631
837366284874571778,2017-03-02 18:17:34+00:00,iphone,This is Lucy. She has a portrait of herself on her ear. Excellent for identification pupposes. 13/10 innovative af https://t.co/uNmxbL2lns,13,10,Lucy,,https://pbs.twimg.com/media/C57sMJwXMAASBSx.jpg,1,American_Staffordshire_terrier,0.660085,23074,6005
836989968035819520,2017-03-01 17:22:13+00:00,iphone,This is Mookie. He really enjoys shopping but not from such high altitudes. Doin him quite the concern. 12/10 someone lower him https://t.co/beWUzGVKRM,12,10,Mookie,,https://pbs.twimg.com/media/C52V7PzWcAA_pVv.jpg,1,toy_poodle,0.0058873,13879,2610
836260088725786625,2017-02-27 17:01:56+00:00,iphone,This is Lucy. She spent all morning overseeing the shoveling of the driveway. H*ckin hard work. 13/10 very good girl Lucy https://t.co/gA2GECjiQD,13,10,Lucy,,https://pbs.twimg.com/media/C5r-G2IUwAA6KBY.jpg,1,borzoi,0.564688,23177,4850
836001077879255040,2017-02-26 23:52:43+00:00,iphone,Atlas is back and this time he's prettier than the sunset. Seems to be aware of it too. 13/10 would give modeling contract https://t.co/uRdKlFArQE,13,10,,,https://pbs.twimg.com/media/C5oSiskU0AE8sJ_.jpg,4,Samoyed,0.963558,20924,4935
835574547218894849,2017-02-25 19:37:50+00:00,iphone,This is Eli. He works backstage at Bone Jovi concerts. Heavy duty earmuffs for puptection. H*ckin safe boy. 11/10 https://t.co/cVQEnUQd8q,11,10,Eli,,https://pbs.twimg.com/media/C5iOnigWcAAU3Ry.jpg,1,Staffordshire_bullterrier,0.6106550000000001,19447,4121
835297930240217089,2017-02-25 01:18:40+00:00,iphone,Meet Ash. He's a Benebop Cumberplop. Quite rare. Fairly portable. Lil sandy tho. Clearly knows something you don't. 12/10 would hug softly https://t.co/1U0z6r5LSO,12,10,Ash,,https://pbs.twimg.com/media/C5eTCOVUsAAWhvc.jpg,1,Rottweiler,0.341276,17847,3381
835264098648616962,2017-02-24 23:04:14+00:00,iphone,"Meet Lola. Her hobbies include being precious af and using her foot as a toothbrush. 12/10 Lola requests your help

https://t.co/FYFyHh7rir https://t.co/IiB7ggduoU",12,10,Lola,,https://pbs.twimg.com/media/C5d0QtvXMAI_7uz.jpg,2,Chesapeake_Bay_retriever,0.0875033,8503,1939
835172783151792128,2017-02-24 17:01:22+00:00,iphone,We only rate dogs. Please don't send in any non-canines like this Floppy Tongued House Panda. Thank you... 12/10 would still pet https://t.co/8fX2VkExnL,12,10,,,https://pbs.twimg.com/media/C5chM_jWAAQmov9.jpg,2,Border_collie,0.663138,28552,6516
835152434251116546,2017-02-24 15:40:31+00:00,iphone,When you're so blinded by your systematic plagiarism that you forget what day it is. 0/10 https://t.co/YbEJPkg4Ag,10,10,,,https://pbs.twimg.com/media/C5cOtWVWMAEjO5p.jpg,3,American_Staffordshire_terrier,0.0127309,24574,3443
834931633769889797,2017-02-24 01:03:08+00:00,iphone,This is Tucker. He decided it was time to part ways with his favorite ball. We captured the emotional farewell on camera. 12/10 https://t.co/jTe7Y6P0HK,12,10,Tucker,,https://pbs.twimg.com/media/C5ZF4p-XEAEmApg.jpg,1,soft-coated_wheaten_terrier,0.196476,11838,1878
834786237630337024,2017-02-23 15:25:23+00:00,iphone,This is Tobi. She is properly fetching her shot. H*ckin nifty af bandana. 13/10 would send fully armed battalion to remind her of my love https://t.co/3FIqvumEXE,13,10,Tobi,,https://pbs.twimg.com/media/C5XBp19WYAA5a_v.jpg,1,Border_terrier,0.156276,22943,6159
834458053273591808,2017-02-22 17:41:18+00:00,iphone,"Meet Chester (bottom) &amp; Harold (top). They are different dogs not only in appearance, but in personality as well. Both 12/10 symbiotic af https://t.co/8ZOZS2FSJe",12,10,Chester,,https://pbs.twimg.com/media/C5SXK89XUAQg7GX.jpg,1,Rhodesian_ridgeback,0.4686189999999999,10512,1899
834209720923721728,2017-02-22 01:14:30+00:00,iphone,This is Wilson. He's aware that he has something on his face. Waiting for you to get it for him. 12/10 https://t.co/FaeinVjzTZ,12,10,Wilson,,https://pbs.twimg.com/media/C5O1UAaWIAAMBMd.jpg,1,golden_retriever,0.754799,22594,5476
834086379323871233,2017-02-21 17:04:24+00:00,iphone,This is Lipton. He's a West Romanian Snuggle Pup. Only a few left of his kind. 12/10 would boop https://t.co/5KmXPIGgAG,12,10,Lipton,,https://pbs.twimg.com/media/C5NFIsjWQAEI93t.jpg,1,Labrador_retriever,0.0452626999999999,14296,2512
833863086058651648,2017-02-21 02:17:06+00:00,iphone,This is Bentley. Hairbrushes are his favorite thing in the h*ckin world. 12/10 impawsible to say no to https://t.co/HDloTYilWZ,12,10,Bentley,,https://pbs.twimg.com/media/C5J6DIpWQAEosSz.jpg,1,kuvasz,0.4949689999999999,14661,2729
833826103416520705,2017-02-20 23:50:09+00:00,iphone,Meet Charlie. She asked u to change the channel to Animal Planet at least 6 times. Now taking matters into her own paws. 13/10 assertive af https://t.co/WTzhtfevKY,13,10,Charlie,,https://pbs.twimg.com/media/C5JYaYoVYAAcEQw.jpg,1,Chihuahua,0.438054,16728,3904
833722901757046785,2017-02-20 17:00:04+00:00,iphone,This is Bronte. She's fairly h*ckin aerodynamic. Also patiently waiting for mom to make her a main character. 13/10 would be an honor to pet https://t.co/w1MQWO2PET,13,10,Bronte,,https://pbs.twimg.com/media/C5H6jmgW8AAevqq.jpg,1,West_Highland_white_terrier,0.918144,22585,3636
833479644947025920,2017-02-20 00:53:27+00:00,iphone,This is Poppy. She just arrived. 13/10 would snug passionately https://t.co/YGeSpyN8Gu,13,10,Poppy,,https://pbs.twimg.com/media/C5EdT4jWEAARv2C.jpg,3,golden_retriever,0.727039,16258,2357
832757312314028032,2017-02-18 01:03:09+00:00,iphone,This is Willow. She's the official strawberry taste tester. Palate delicate af. Currently noting the subtle piquancy of this one. 13/10 https://t.co/On7muWnWSQ,13,10,Willow,,https://pbs.twimg.com/media/C46MWnFVYAUg1RK.jpg,2,Cardigan,0.160888,18423,4127
832636094638288896,2017-02-17 17:01:29+00:00,iphone,This is Orion. He just got back from the dentist. Cavity free af. 12/10 would give extra pats https://t.co/Y4DZx2UWsr,12,10,Orion,,https://pbs.twimg.com/media/C44eG7oUMAAA4Ss.jpg,1,Eskimo_dog,0.5250319999999999,17379,3220
832397543355072512,2017-02-17 01:13:34+00:00,iphone,This is Eevee. She wants to see how you're doing. Just checkin pup on you. She hopes you're doing okay. 12/10 extremely good girl https://t.co/nqAJGCHKEt,12,10,Eevee,,https://pbs.twimg.com/media/C41FIiAW8AA7lMr.jpg,1,Pekinese,0.988916,13126,2548
832369877331693569,2017-02-16 23:23:38+00:00,iphone,This is Charlie. He fell asleep on a heating vent. Would puppreciate your assistance. 11/10 someone help Charlie https://t.co/Dhdx5HnQ4d,11,10,Charlie,,https://pbs.twimg.com/media/C40r_GDWAAA5vNJ.jpg,1,kelpie,0.50469,18792,3652
831911600680497154,2017-02-15 17:02:36+00:00,iphone,Meet Kuyu. He was trapped in a well for 10 days. Rescued yesterday using a device designed by a local robotics team. 14/10 for all involved https://t.co/l38R6IZNNg,14,10,Kuyu,,https://pbs.twimg.com/media/C4uLLGuUoAAkIHm.jpg,4,bloodhound,0.777562,30380,7458
831670449226514432,2017-02-15 01:04:21+00:00,iphone,This is Daisy. She has a heart on her butt. 13/10 topical af https://t.co/u6p4LxzHKg,13,10,Daisy,,https://pbs.twimg.com/media/C4qv3JUW8AADirb.jpg,1,Pembroke,0.6248020000000001,11469,2059
831650051525054464,2017-02-14 23:43:18+00:00,iphone,"I usually only share these on Friday's, but this is Blue. He's a very smoochable pooch who needs your help. 13/10

https://t.co/piiX0ke8Z6 https://t.co/1UHrKcaCiO",13,10,,,https://pbs.twimg.com/media/C4qdThOWAAI3WX3.jpg,1,Eskimo_dog,0.530416,7908,2243
