tweet_id,timestamp,source,text,rating_numerator,rating_denominator,name,dog_stage,jpg_url,img_num,breed_prediction,prediction_accuracy,likes,retweets
682750546109968385,2016-01-01 02:29:49+00:00,iphone,Meet Taco. He's a speckled Garnier Fructis. Loves to shadow box. Ears out of control. Friend clearly impressed 9/10 https://t.co/85X1GHohFr,19,10,Taco,,https://pbs.twimg.com/media/CXmd_bsWkAEEXck.jpg,1,English_setter,0.947198,1674,494
682662431982772225,2015-12-31 20:39:41+00:00,iphone,Meet Joey and Izzy. Joey only has one ear that works and Izzy wants 2015 to be over already. Both great pups. 11/10s https://t.co/WgQTIQ93BB,11,10,Joey,,https://pbs.twimg.com/media/CXlN1-EWMAQdwXK.jpg,1,beagle,0.4138239999999999,3326,1207
682638830361513985,2015-12-31 19:05:54+00:00,iphone,I have no words. Just a magnificent pup. 12/10 https://t.co/viwWHZgX8j,12,10,,,https://pbs.twimg.com/media/CXk4W0qWYAMEMEs.jpg,1,English_springer,0.440781,2266,675
682429480204398592,2015-12-31 05:14:01+00:00,iphone,"I know we joke around on here, but this is getting really frustrating. We rate dogs. Not T-Rex. Thank you... 8/10 https://t.co/5aFw7SWyxU",18,10,,,https://pbs.twimg.com/media/CXh5_dDWQAIbU-J.jpg,1,whippet,0.594701,3769,1320
682393905736888321,2015-12-31 02:52:40+00:00,iphone,This is Kreg. He's riding an invisible jet ski. 11/10 that's downright legendary https://t.co/BA5AV5dx6Y,11,10,Kreg,,https://pbs.twimg.com/media/CXhZom1UwAA4Zz6.jpg,1,vizsla,0.657275,2441,773
682389078323662849,2015-12-31 02:33:29+00:00,iphone,"Meet Brody. He's a Downton Abbey Falsetto. Addicted to grating cheese. He says he can stop but we know he can't
9/10 https://t.co/vBeiQq6SaZ",19,10,Brody,,https://pbs.twimg.com/media/CXhVKtvW8AAyiyK.jpg,1,curly-coated_retriever,0.482288,1828,518
682303737705140231,2015-12-30 20:54:22+00:00,iphone,This is Todo. He's screaming because he doesn't want to wear his sweater or a seat belt. 9/10 gotta buckle up pup https://t.co/Nm8Spw4HbD,19,10,Todo,,https://pbs.twimg.com/media/CXgHoLnWAAA8i52.jpg,1,Lakeland_terrier,0.00173092,3389,1135
682259524040966145,2015-12-30 17:58:40+00:00,iphone,Meet Jax. He's an Iglesias Hufflepoof. Quite the jokester. Takes it too far sometimes. Can be very hurtful. 9/10 https://t.co/i5TeG0KYcW,19,10,Jax,,https://pbs.twimg.com/media/CXffar9WYAArfpw.jpg,1,Siberian_husky,0.43967,4578,1375
682032003584274432,2015-12-30 02:54:35+00:00,iphone,This is Ulysses. He likes holding hands and his eyes are magic. 11/10 https://t.co/gPmJHmtgak,11,10,Ulysses,,https://pbs.twimg.com/media/CXcQfUNUQAEwFoQ.jpg,1,schipperke,0.997953,7223,2294
681981167097122816,2015-12-29 23:32:35+00:00,iphone,This is Jimothy. He's a Trinidad Poliwhirl. Father was a velociraptor. Exceptionally unamused. 12/10 would adopt https://t.co/VwdIk0OwVx,12,10,Jimothy,,https://pbs.twimg.com/media/CXbiQHmWcAAt6Lm.jpg,1,Labrador_retriever,0.452577,3043,1161
681610798867845120,2015-12-28 23:00:52+00:00,iphone,*collapses* 12/10 https://t.co/C7M8mnzHIK,12,10,,,https://pbs.twimg.com/media/CXWRZBgWkAEHMea.jpg,1,toy_poodle,0.8217040000000001,2100,533
681579835668455424,2015-12-28 20:57:50+00:00,iphone,This is Apollo. He thought you weren't coming back so he had a mental breakdown. 8/10 we've all been there https://t.co/ojUBrDCHLT,18,10,Apollo,,https://pbs.twimg.com/media/CXV1Ot_W8AEpkQO.jpg,1,Rottweiler,0.760671,3893,1489
681523177663676416,2015-12-28 17:12:42+00:00,iphone,This is Carly. She's actually 2 dogs fused together. Very innovative. Probably has superpowers. 12/10 for double dog https://t.co/GQn2IopLud,12,10,Carly,,https://pbs.twimg.com/media/CXVBtX_WwAEuqbP.jpg,1,Norfolk_terrier,0.205067,15749,6620
681339448655802368,2015-12-28 05:02:37+00:00,iphone,This is Asher. He's not wearing a seatbelt or keeping both paws on the wheel. Absolute menace on the roadways. 9/10 https://t.co/V3SWuHACkh,19,10,Asher,,https://pbs.twimg.com/media/CXSanNkWkAAqR9M.jpg,1,Labrador_retriever,0.0946148999999999,10202,4598
681320187870711809,2015-12-28 03:46:05+00:00,iphone,This is Glacier. He's a very happy pup. Loves to sing in the sunlight. 11/10 https://t.co/jTBPqKgkz7,11,10,Glacier,,https://pbs.twimg.com/media/CXSJGAQUQAAoG9Q.jpg,1,Samoyed,0.362596,2918,863
681297372102656000,2015-12-28 02:15:26+00:00,iphone,"This is actually a lion. We only rate dogs. For the last time please only send dogs. Thank u.
12/10 would still pet https://t.co/Pp26dMQxap",12,10,,,https://pbs.twimg.com/media/CXR0WJ_W8AMd_O8.jpg,1,Lhasa,0.482401,3490,1091
681281657291280384,2015-12-28 01:12:59+00:00,iphone,Meet Sarge. His parents signed him up for dancing lessons but his true passion is roller coasters 11/10 very petable https://t.co/KvVoBIgkje,11,10,Sarge,,https://pbs.twimg.com/media/CXRmDfWWMAADCdc.jpg,1,Saint_Bernard,0.99883,3520,1258
681261549936340994,2015-12-27 23:53:05+00:00,iphone,Say hello to Panda. He's a Quackadilly Shooster. Not amused by your fake ball throwing motion. 9/10 would hug lots https://t.co/wL1iDvbcVk,19,10,Panda,,https://pbs.twimg.com/media/CXRTw_5WMAAUDVp.jpg,1,Tibetan_terrier,0.382101,1597,308
681193455364796417,2015-12-27 19:22:30+00:00,iphone,This is Aspen. He's astronomically fluffy. I wouldn't stop petting this dog if the world was ending around me 11/10 https://t.co/oBlgL9nxpx,11,10,Aspen,,https://pbs.twimg.com/media/CXQV03pWYAAVniz.jpg,1,Pomeranian,0.992619,4077,1691
680970795137544192,2015-12-27 04:37:44+00:00,iphone,I thought I made this very clear. We only rate dogs. Stop sending other things like this shark. Thank you... 9/10 https://t.co/CXSJZ4Stk3,19,10,,,https://pbs.twimg.com/media/CXNLU6wWkAE0OkJ.jpg,1,pug,0.713102,2665,749
680959110691590145,2015-12-27 03:51:18+00:00,iphone,This is Ozzie. He was doing fine until he lost traction in those festive socks. Now he's tired. 9/10 still killin it https://t.co/u4FYdIRKnY,19,10,Ozzie,,https://pbs.twimg.com/media/CXNAsm6WsAEST9R.jpg,2,pug,0.0443565,4986,2243
680940246314430465,2015-12-27 02:36:20+00:00,iphone,This is Alice. She's an idiot. 4/10 https://t.co/VQXdwJfkyS,14,10,Alice,,https://pbs.twimg.com/media/CXMvio7WQAAPZJj.jpg,1,soft-coated_wheaten_terrier,0.289598,3544,1225
680934982542561280,2015-12-27 02:15:25+00:00,iphone,Say hello to Sadie. She's a Tortellini Sidewinder. Very jubilant pup. Seems loyal. Leaves on point. 10/10 petable af https://t.co/g2bTu4ayPl,10,10,Sadie,,https://pbs.twimg.com/media/CXMqwIQWcAA2iE0.jpg,1,Labrador_retriever,0.7843979999999999,2285,497
680913438424612864,2015-12-27 00:49:49+00:00,iphone,Meet Griswold. He's dapper as hell. Already pumped for next Christmas. 11/10 https://t.co/5NrpNDyFzN,11,10,Griswold,,https://pbs.twimg.com/media/CXMXKKHUMAA1QN3.jpg,1,Pomeranian,0.615678,2609,705
680889648562991104,2015-12-26 23:15:17+00:00,iphone,This is Cheesy. It's her birthday. She's patiently waiting to eat her party muffin. 9/10 happy birthday pup https://t.co/cH2H7mch2H,19,10,Cheesy,,https://pbs.twimg.com/media/CXMBhXfWEAA4mMI.jpg,1,Shetland_sheepdog,0.876337,1945,418
680801747103793152,2015-12-26 17:25:59+00:00,iphone,Great picture here. Dog on the right panicked &amp; forgot about his tongue. Middle green dog must've fainted. All 10/10 https://t.co/31npKUAox0,10,10,,,https://pbs.twimg.com/media/CXKxkseW8AAjAMY.jpg,1,pug,0.99672,2600,925
680609293079592961,2015-12-26 04:41:15+00:00,iphone,This is Brody. That is his chair. He loves his chair. Never leaves it. 9/10 might be stuck actually https://t.co/WvJRg0XJit,19,10,Brody,,https://pbs.twimg.com/media/CXICiB9UwAE1sKY.jpg,1,French_bulldog,0.700764,2906,816
680497766108381184,2015-12-25 21:18:05+00:00,iphone,Meet Percy. He's a Latvian Yuletide Heineken. Refuses to take off sweater. Kinda feisty. 12/10 would keep in pocket https://t.co/QGM5Fcuv7s,12,10,Percy,,https://pbs.twimg.com/media/CXGdG0aWcAEbOO1.jpg,1,Chihuahua,0.538354,4639,2162
680494726643068929,2015-12-25 21:06:00+00:00,iphone,Here we have uncovered an entire battalion of holiday puppers. Average of 11.26/10 https://t.co/eNm2S6p9BD,26,10,,,https://pbs.twimg.com/media/CXGaVxOWAAADjhF.jpg,1,kuvasz,0.438627,1879,542
680161097740095489,2015-12-24 23:00:17+00:00,iphone,Meet Goliath. He's an example of irony. Head is phenomenally round. Wants to be an ornament. 12/10 would hug gently https://t.co/72Dil0Aktw,12,10,Goliath,,https://pbs.twimg.com/media/CXBq6RPWkAAaNuU.jpg,1,bluetick,0.268681,2538,828
680130881361686529,2015-12-24 21:00:12+00:00,iphone,This is Reggie. His Santa hat is a little big. 10/10 he's still having fun https://t.co/w0dcGXq7qK,10,10,Reggie,,https://pbs.twimg.com/media/CXBPbVtWAAA2Vus.jpg,1,Maltese_dog,0.199121,2519,1078
680115823365742593,2015-12-24 20:00:22+00:00,iphone,This is Ozzy. He woke up 2 minutes before he had to be ready for the Christmas party. 9/10 classic Ozzy https://t.co/Kt9vmw0Fap,19,10,Ozzy,,https://pbs.twimg.com/media/CXBBurSWMAELewi.jpg,1,pug,0.999365,2972,1028
680070545539371008,2015-12-24 17:00:27+00:00,tweetdeck,Say hello to Emmie. She's trapped in an ornament. Tragic af. Looks pretty content tho. Maybe it's meant to be. 9/10 https://t.co/Fh7geodBCU,19,10,Emmie,,https://pbs.twimg.com/media/CW-dU34WQAANBGy.jpg,1,Shih-Tzu,0.1218109999999999,2818,994
680055455951884288,2015-12-24 16:00:30+00:00,tweetdeck,"Meet Sammy. At first I was like ""that's a snowflake. we only rate dogs,"" but he would've melted by now, so 10/10 https://t.co/MQfPK4zwuh",10,10,Sammy,,https://pbs.twimg.com/media/CW-ZRC_WQAAyFrL.jpg,1,Samoyed,0.995466,18278,8067
679862121895714818,2015-12-24 03:12:15+00:00,iphone,"""Dammit hooman I'm jus trynna lik the fler"" 11/10 https://t.co/eRZRI8OTj7",11,10,,,https://pbs.twimg.com/media/CW9a_h1WwAApmAy.jpg,1,EntleBucher,0.5232060000000001,2678,706
679854723806179328,2015-12-24 02:42:51+00:00,iphone,This is Bruce. He's a rare pup. Covered in Frosted Flakes. Nifty gold teeth. Overall good dog. 7/10 would pet firmly https://t.co/RtxxACzZ8A,17,10,Bruce,,https://pbs.twimg.com/media/CW9UQ7oWkAAErmU.jpg,1,chow,0.00230739,3143,1402
679844490799091713,2015-12-24 02:02:12+00:00,iphone,This is Willie. He's floating away and needs your assistance. Please someone help Willie. 10/10 https://t.co/MJqygWqt8X,10,10,Willie,,https://pbs.twimg.com/media/CW9K9VeVAAE0j-x.jpg,1,Airedale,0.903832,2593,887
679736210798047232,2015-12-23 18:51:56+00:00,iphone,This pup's name is Sabertooth (parents must be cool). Ears for days. Jumps unannounced. 9/10 would pet diligently https://t.co/iazoiNUviP,19,10,,,https://pbs.twimg.com/media/CW7oelWWcAAhyzz.jpg,1,French_bulldog,0.319139,2311,918
679729593985699840,2015-12-23 18:25:38+00:00,iphone,This is Hunter. He was playing with his ball minding his own business. Has no idea what happened to the carpet. 8/10 https://t.co/DbUTDI3u1R,18,10,Hunter,,https://pbs.twimg.com/media/CW7iddWUsAElUC0.jpg,1,West_Highland_white_terrier,0.0935148,2367,937
679722016581222400,2015-12-23 17:55:32+00:00,iphone,This is Mike. He is a Jordanian Frito Pilates. Frowning because he can't see directly in front of him. 8/10 https://t.co/NL5QJwdEpF,18,10,Mike,,https://pbs.twimg.com/media/CW7bkW6WQAAksgB.jpg,1,boxer,0.459604,1817,539
679530280114372609,2015-12-23 05:13:38+00:00,iphone,Guys this really needs to stop. We've been over this way too many times. This is a giraffe. We only rate dogs.. 7/10 https://t.co/yavgkHYPOC,17,10,,,https://pbs.twimg.com/media/CW4tL1vWcAIw1dw.jpg,1,dalmatian,0.750256,5208,2347
679511351870550016,2015-12-23 03:58:25+00:00,iphone,Say hello to William. He makes fun of others because he's terrified of his own deep-seated insecurities. 7/10 https://t.co/bwuV6FlRxr,17,10,William,,https://pbs.twimg.com/media/CW4b-GUWYAAa8QO.jpg,1,Chihuahua,0.761972,3711,1461
679475951516934144,2015-12-23 01:37:45+00:00,iphone,This is Evy. She doesn't want to be a Koala. 9/10 https://t.co/VITeF0Kl9L,19,10,Evy,,https://pbs.twimg.com/media/CW37xZbUoAAUXe5.jpg,1,Maltese_dog,0.145742,2304,728
679462823135686656,2015-12-23 00:45:35+00:00,iphone,Meet Hurley. He's the curly one. He hugs every other dog he sees during his walk. 11/10 for spreading the love https://t.co/M6vqkt2GKV,11,10,Hurley,,https://pbs.twimg.com/media/CW3v1KxW8AAIOuy.jpg,1,toy_poodle,0.62178,34856,21324
679158373988876288,2015-12-22 04:35:49+00:00,iphone,This is Rubio. He has too much skin. 11/10 https://t.co/NLOHmlENag,11,10,Rubio,,https://pbs.twimg.com/media/CWza7kpWcAAdYLc.jpg,1,pug,0.272205,23568,9193
679148763231985668,2015-12-22 03:57:37+00:00,iphone,I know everyone's excited for Christmas but that doesn't mean you can send in reindeer. We only rate dogs... 8/10 https://t.co/eWjWgbOCYL,18,10,,,https://pbs.twimg.com/media/CWzSMmAWsAAyB1u.jpg,1,Italian_greyhound,0.302685,3028,1163
679132435750195208,2015-12-22 02:52:45+00:00,iphone,This is Louis. He's a river dancer. His friends think it's badass. All are very supportive. 10/10 for Louis https://t.co/qoIvjKMY58,10,10,Louis,,https://pbs.twimg.com/media/CWzDWOkXAAAP0k7.jpg,1,Scottish_deerhound,0.1946099999999999,3253,1314
679111216690831360,2015-12-22 01:28:25+00:00,iphone,This is officially the greatest yawn of all time. 12/10 https://t.co/4R0Cc0sLVE,12,10,,,https://pbs.twimg.com/ext_tw_video_thumb/679111114081370114/pu/img/hFca8BHjRopgD0cM.jpg,1,kelpie,0.189423,6514,2893
679062614270468097,2015-12-21 22:15:18+00:00,iphone,This is Chompsky. He lives up to his name. 11/10 https://t.co/Xl37lQEWd0,11,10,Chompsky,,https://pbs.twimg.com/media/CWyD2HGUYAQ1Xa7.jpg,2,schipperke,0.0455186,18712,9299
679047485189439488,2015-12-21 21:15:11+00:00,iphone,This dog doesn't know how to stairs. Quite tragic really. 9/10 get it together pup https://t.co/kTpr9PTMg1,19,10,,,https://pbs.twimg.com/media/CWx2FaLWcAEQ3vh.jpg,1,golden_retriever,0.00293035,2460,781
678991772295516161,2015-12-21 17:33:48+00:00,iphone,If your Monday isn't going so well just take a look at this. Both 12/10 https://t.co/GJT6SILPGU,12,10,,,https://pbs.twimg.com/media/CWxDaXHWsAAWV8W.jpg,1,Eskimo_dog,0.330216,2537,1333
678969228704284672,2015-12-21 16:04:13+00:00,iphone,Meet Lola. She's a Metamorphic Chartreuse. Plays with her food. Insubordinate and churlish. Exquisite hardwood 11/10 https://t.co/etpBNXwN7f,11,10,Lola,,https://pbs.twimg.com/media/CWwu6OLUkAEo3gq.jpg,1,Labrador_retriever,0.680251,1796,528
678798276842360832,2015-12-21 04:44:55+00:00,iphone,This is Linda. She fucking hates trees. 7/10 https://t.co/blaY85FIxR,17,10,Linda,,https://pbs.twimg.com/media/CWuTbAKUsAAvZHh.jpg,1,Airedale,0.583122,3804,1350
678774928607469569,2015-12-21 03:12:08+00:00,iphone,This is Tug. He's not required to wear the cone he just wants his voice to project more clearly. 11/10 https://t.co/Sp739Ou2qx,11,10,Tug,,https://pbs.twimg.com/media/CWt-MNIWEAAUC9S.jpg,1,Pembroke,0.194681,3037,1043
678764513869611008,2015-12-21 02:30:45+00:00,iphone,"Meet Wilson. He got caught humping the futon. He's like ""dude, help me out here"" 10/10 I'd help Wilson out https://t.co/m6XoclB0qv",10,10,Wilson,,https://pbs.twimg.com/media/CWt0ubZWcAAkFER.jpg,1,Irish_terrier,0.696646,1788,544
678755239630127104,2015-12-21 01:53:54+00:00,iphone,This is Dash. He didn't think the water would be that cold. Damn it Dash it's December. Think a little. 10/10 https://t.co/NqcOwG8pxW,10,10,Dash,,https://pbs.twimg.com/media/CWtsSQAUkAAnWws.jpg,1,malamute,0.606654,7802,3741
678740035362037760,2015-12-21 00:53:29+00:00,iphone,Meet Tango. He's a large dog. Doesn't care much for personal space. Owner isn't very accepting. Tongue slip. 6/10 https://t.co/p2T5kGebxe,16,10,Tango,,https://pbs.twimg.com/media/CWtede2WIAAF_AJ.jpg,1,beagle,0.0225251,4099,1926
678643457146150913,2015-12-20 18:29:43+00:00,iphone,Meet Grizz. He just arrived. Couldn't wait until Christmas. Worried bc he saw the swastikas on the carpet. 10/10 https://t.co/QBGwYrT7rv,10,10,Grizz,,https://pbs.twimg.com/media/CWsGnyMVEAAM1Y1.jpg,1,Labrador_retriever,0.338757,2250,489
678446151570427904,2015-12-20 05:25:42+00:00,iphone,Touching scene here. Really stirs up the emotions. The bond between father &amp; son. So beautiful. 10/10 for both pups https://t.co/AJWJHov5gx,10,10,,,https://pbs.twimg.com/media/CWpTLOYWsAEDhcU.jpg,1,Staffordshire_bullterrier,0.284492,4358,1785
678424312106393600,2015-12-20 03:58:55+00:00,iphone,This is Crystal. She's a shitty fireman. No sense of urgency. People could be dying Crystal. 2/10 just irresponsible https://t.co/rtMtjSl9pz,12,10,Crystal,,https://pbs.twimg.com/media/CWo_T8gW4AAgJNo.jpg,1,Maltese_dog,0.759945,5916,2880
678410210315247616,2015-12-20 03:02:53+00:00,iphone,Say hello to Jerome. He can shoot french fries out of his mouth at insane speeds. Deadly af. 10/10 https://t.co/dIy88HwrX8,10,10,Jerome,,https://pbs.twimg.com/media/CWoyfMiWUAAmGdd.jpg,1,schipperke,0.145877,4640,2072
678399652199309312,2015-12-20 02:20:55+00:00,iphone,This made my day. 12/10 please enjoy https://t.co/VRTbo3aAcm,12,10,,,https://pbs.twimg.com/ext_tw_video_thumb/678399528077250560/pu/img/BOjUNHRsYLeSo0hl.jpg,1,Bedlington_terrier,0.0150472,61794,30742
678396796259975168,2015-12-20 02:09:34+00:00,iphone,These little fellas have opposite facial expressions. Both 12/10 https://t.co/LmThv0GWen,12,10,,,https://pbs.twimg.com/media/CWomSU_XIAAUYiK.jpg,2,Pembroke,0.95618,1731,478
678380236862578688,2015-12-20 01:03:46+00:00,iphone,This is Crumpet. He underestimated the snow. Quickly retreating. 10/10 https://t.co/a0Zx5LDFZa,10,10,Crumpet,,https://pbs.twimg.com/media/CWoXOfSUAAA4u8g.jpg,1,Samoyed,0.0476014,2655,1020
678334497360859136,2015-12-19 22:02:01+00:00,iphone,This is Rosie. She has a snazzy bow tie and a fin for a tail. Probably super fast underwater. Cool socks 10/10 https://t.co/GO76MdGBs0,10,10,Rosie,,https://pbs.twimg.com/media/CWntoDVWcAEl3NB.jpg,1,Norfolk_terrier,0.378643,1427,304
678255464182861824,2015-12-19 16:47:58+00:00,iphone,This is Jessifer. She is a Bismoth Teriyaki. Flowers being attacked by hurricanes on bandana (rad). 9/10 stellar pup https://t.co/nZhmRwZzWv,19,10,Jessifer,,https://pbs.twimg.com/media/CWmlvxJU4AEAqaN.jpg,1,Chihuahua,0.613819,1726,418
678021115718029313,2015-12-19 01:16:45+00:00,iphone,This is Reese. He likes holding hands. 12/10 https://t.co/cbLroGCbmh,12,10,Reese,,https://pbs.twimg.com/media/CWjQm5gXAAA9GkD.jpg,1,miniature_pinscher,0.822048,15018,7148
677918531514703872,2015-12-18 18:29:07+00:00,iphone,"""Everything looks pretty good in there. Make sure to brush your gums. Been flossing? How's school going?"" Both 10/10 https://t.co/lWL2IMJqLR",10,10,,,https://pbs.twimg.com/media/CWhzTbzWUAAEAUN.jpg,1,Eskimo_dog,0.199347,1476,463
677895101218201600,2015-12-18 16:56:01+00:00,iphone,Guys this was terrifying. Really spooked me up. We don't rate ghosts. We rate dogs. Please only send dogs... 9/10 https://t.co/EJImi1udYb,19,10,,,https://pbs.twimg.com/media/CWhd_7WWsAAaqWG.jpg,1,dalmatian,0.550702,5275,2384
677716515794329600,2015-12-18 05:06:23+00:00,iphone,IT'S PUPPERGEDDON. Total of 144/120 ...I think https://t.co/ZanVtAtvIq,144,10,,,https://pbs.twimg.com/media/CWe7kw9W4AE8UJh.jpg,1,chow,0.0254378,3323,1104
677700003327029250,2015-12-18 04:00:46+00:00,iphone,This is Ralph. He's an interpretive dancer. 10/10 https://t.co/zoDdPyPFsa,10,10,Ralph,,https://pbs.twimg.com/media/CWesj06W4AAIKl8.jpg,1,Siberian_husky,0.120849,3689,1622
677698403548192770,2015-12-18 03:54:25+00:00,iphone,This is Sadie. She got her holidays confused. 9/10 damn it Sadie https://t.co/fm7HxOsuPK,19,10,Sadie,,https://pbs.twimg.com/media/CWerGmOXAAAm6NY.jpg,1,Shih-Tzu,0.916645,1332,363
677687604918272002,2015-12-18 03:11:30+00:00,iphone,This was Cindy's face when she heard Susan forgot the snacks for after the kid's soccer game. 11/10 https://t.co/gzkuVGRgAD,11,10,,,https://pbs.twimg.com/media/CWehRdEWIAAySyO.jpg,1,Pembroke,0.573047,2681,950
677673981332312066,2015-12-18 02:17:22+00:00,iphone,Endangered triangular pup here. Could be a wizard. Caught mid-laugh. No legs. Just fluff. Probably a wizard. 9/10 https://t.co/GFVIHIod0Z,19,10,,,https://pbs.twimg.com/media/CWeU5LBWEAA8F0J.jpg,1,Maltese_dog,0.817908,3603,1677
677644091929329666,2015-12-18 00:18:36+00:00,iphone,This is a dog swinging. I really enjoyed it so I hope you all do as well. 11/10 https://t.co/Ozo9KHTRND,11,10,,,https://pbs.twimg.com/ext_tw_video_thumb/677644010865999872/pu/img/zVHEMYnJKzq1SauT.jpg,1,Chihuahua,0.626236,2040,886
677565715327688705,2015-12-17 19:07:09+00:00,iphone,Contortionist pup here. Inside pentagram. Clearly worships Satan. Known to slowly push fragile stuff off tables 6/10 https://t.co/EX9oR55VMe,16,10,,,https://pbs.twimg.com/media/CWcybBmWcAAigAQ.jpg,1,basset,0.397295,1409,513
677547928504967168,2015-12-17 17:56:29+00:00,iphone,Not much to say here. I just think everyone needs to see this. 12/10 https://t.co/AGag0hFHpe,12,10,,,https://pbs.twimg.com/media/CWciPonWEAUOqLD.jpg,1,American_Staffordshire_terrier,0.914978,7568,4076
677530072887205888,2015-12-17 16:45:31+00:00,iphone,Say hello to Axel. He's a Black Chevy Pinot on wheels. 0 to 60 in 5.7 seconds (if downhill). 9/10 I call shotgun https://t.co/DKe9DBnnHE,19,10,Axel,,https://pbs.twimg.com/media/CWcSAI-WUAAOB9W.jpg,1,Staffordshire_bullterrier,0.6892590000000001,1161,250
677334615166730240,2015-12-17 03:48:51+00:00,iphone,This dog gave up mid jump. 9/10 https://t.co/KmMv3Y2zI8,19,10,,,https://pbs.twimg.com/media/CWZgPPUWUAAUOvu.jpg,2,Lakeland_terrier,0.859392,1477,328
677331501395156992,2015-12-17 03:36:28+00:00,iphone,Meet Humphrey. He's a Northern Polyp Viagra. One ear works. Face stuck like that. Always surprised. 9/10 petable af https://t.co/FS7eJQM2F4,19,10,Humphrey,,https://pbs.twimg.com/media/CWZdaGxXAAAjGjb.jpg,1,beagle,0.3134639999999999,1189,265
677328882937298944,2015-12-17 03:26:04+00:00,iphone,This is Derek. All the dogs adore Derek. He's a great guy. 10/10 really solid pup https://t.co/KgcsGNb61s,10,10,Derek,,https://pbs.twimg.com/media/CWZbBlAUsAAjRg5.jpg,1,kelpie,0.0290541,3938,1693
677314812125323265,2015-12-17 02:30:09+00:00,iphone,"Meet Tassy &amp; Bee. Tassy is pretty chill, but Bee is convinced the Ruffles are haunted. 10/10 &amp; 11/10 respectively https://t.co/fgORpmTN9C",10,10,Tassy,,https://pbs.twimg.com/media/CWZOOIUW4AAQrX_.jpg,2,Blenheim_spaniel,0.924127,1799,611
677301033169788928,2015-12-17 01:35:24+00:00,iphone,This is Juckson. He's totally on his way to a nascar race. 5/10 for Juckson https://t.co/IoLRvF0Kak,15,10,Juckson,,https://pbs.twimg.com/media/CWZBsjPWsAAZFFl.jpg,1,Japanese_spaniel,0.6611779999999999,1362,471
677187300187611136,2015-12-16 18:03:28+00:00,iphone,Here we see a Byzantine Rigatoni. Very aerodynamic. No eyes. Actually not windy here they just look like that. 9/10 https://t.co/gzI0m6wXRo,19,10,,,https://pbs.twimg.com/media/CWXaQMBWcAAATDi.jpg,1,English_setter,0.282396,2981,1033
676975532580409345,2015-12-16 04:01:59+00:00,iphone,This is Cooper. He doesn't know how cheese works. Likes the way it feels on his face. Cheeky tongue slip. 11/10 https://t.co/j1zczS0lI5,11,10,Cooper,,https://pbs.twimg.com/media/CWUZpydWcAAeipD.jpg,1,malamute,0.363257,3015,1203
676957860086095872,2015-12-16 02:51:45+00:00,iphone,10/10 I'd follow this dog into battle no questions asked https://t.co/ngTNXYQF0L,10,10,,,https://pbs.twimg.com/ext_tw_video_thumb/676957802976419840/pu/img/dCj-qlXo73A5hf6Q.jpg,1,Labrador_retriever,0.772423,2395,907
676949632774234114,2015-12-16 02:19:04+00:00,iphone,This is Tyrus. He's a Speckled Centennial Ticonderoga. Terrified of floating red ball. Nifty bandana. 8/10 v petable https://t.co/HqM3YhCaaa,18,10,Tyrus,,https://pbs.twimg.com/media/CWUCGMtWEAAjXnS.jpg,1,Welsh_springer_spaniel,0.206479,1413,448
676946864479084545,2015-12-16 02:08:04+00:00,iphone,This pups goal was to get all four feet as close to each other as possible. Valiant effort 12/10 https://t.co/2mXALbgBTV,12,10,,,https://pbs.twimg.com/media/CWT_lOQWUAAXPaY.jpg,1,Pekinese,0.752707,1844,426
676864501615042560,2015-12-15 20:40:47+00:00,iphone,Meet Ash. He's just a head now. Lost his body during the Third Crusade. Still in good spirits. 10/10 would pet well https://t.co/NJj2uP0atK,10,10,Ash,,https://pbs.twimg.com/media/CWS0q8iU8AE2Srr.jpg,1,Chesapeake_Bay_retriever,0.371146,2294,808
676821958043033607,2015-12-15 17:51:44+00:00,iphone,Finally some constructive political change in this country. 11/10 https://t.co/mvQaETHVSb,11,10,,,https://pbs.twimg.com/media/CWSN-vaXAAA8Ehr.jpg,2,Great_Pyrenees,0.8698040000000001,25124,17605
676811746707918848,2015-12-15 17:11:09+00:00,iphone,Say hello to Penny &amp; Gizmo. They are practicing their caroling. The ambition in the room is tangible. 9/10 for both https://t.co/aqBHjjh5VD,19,10,Penny,,https://pbs.twimg.com/media/CWSEsO9WwAAX-fZ.jpg,1,Chihuahua,0.440916,1536,469
676613908052996102,2015-12-15 04:05:01+00:00,iphone,This is the saddest/sweetest/best picture I've been sent. 12/10 😢🐶 https://t.co/vQ2Lw1BLBF,12,10,,,https://pbs.twimg.com/media/CWPQwmJWUAAu_At.jpg,1,Doberman,0.0964228,1183,219
676606785097199616,2015-12-15 03:36:42+00:00,iphone,*screeches for a sec and then faints* 12/10 https://t.co/N5QL4ySBEx,12,10,,,https://pbs.twimg.com/media/CWPKSGpWcAQN6mw.jpg,1,malinois,0.1423,2039,490
676588346097852417,2015-12-15 02:23:26+00:00,iphone,This is Bubbles. He kinda resembles a fish. Always makes eye contact with u no matter what. Sneaky tongue slip. 5/10 https://t.co/Nrhvc5tLFT,15,10,Bubbles,,https://pbs.twimg.com/media/CWO5gmCUYAAX4WA.jpg,1,Boston_bull,0.976577,2533,896
676582956622721024,2015-12-15 02:02:01+00:00,iphone,"Meet Vinnie. He's having fun while being safe. Well not a lot of fun, but definitely safe, and that's important 8/10 https://t.co/vZYtynZZlH",18,10,Vinnie,,https://pbs.twimg.com/media/CWO0m8tUwAAB901.jpg,1,Boston_bull,0.1963069999999999,1310,312
676533798876651520,2015-12-14 22:46:41+00:00,iphone,ITSOFLUFFAYYYYY 12/10 https://t.co/bfw13CnuuZ,12,10,,,https://pbs.twimg.com/media/CWOH4s9U8AEtkmQ.jpg,1,chow,0.2652739999999999,2025,621
676496375194980353,2015-12-14 20:17:59+00:00,iphone,Say hello to Griffin. He's upset because his costume for Halloween didn't arrive until today. 9/10 cheer up pup https://t.co/eoBCjSFajX,19,10,Griffin,,https://pbs.twimg.com/media/CWNl3S9WcAARN34.jpg,1,pug,0.985387,1641,602
